{
  "schemaVersion": 1,
  "runId": "w3-model-ab-a",
  "comparisonId": "w3-model-ab",
  "attemptIndex": 0,
  "identity": {
    "taskId": "smoke-fix-greeting",
    "baseSha": "aaaaaaaaaaaaaaaaaaaaaaaaaaaaaaaaaaaaaaaa",
    "fixtureVersion": "smoke-v0.1",
    "startedAt": "2026-07-30T01:00:00.000Z",
    "agentCommit": "bbbbbbbbbbbbbbbbbbbbbbbbbbbbbbbbbbbbbbbb",
    "harnessCommit": "cccccccccccccccccccccccccccccccccccccccc"
  },
  "model": {
    "provider": "example-provider",
    "modelId": "model-alpha",
    "modelRevision": "2026-07-01",
    "reasoningEffort": "medium",
    "temperature": "unsupported",
    "topP": "unsupported",
    "seed": "unsupported"
  },
  "prompt": {
    "systemPromptHash": "1111111111111111111111111111111111111111111111111111111111111111"
  },
  "tools": {
    "toolSchemaHash": "2222222222222222222222222222222222222222222222222222222222222222",
    "enabledTools": ["read_file", "apply_patch", "exec"],
    "toolPolicyHash": "3333333333333333333333333333333333333333333333333333333333333333"
  },
  "context": {
    "contextStrategy": "full-transcript-v1",
    "maxContextTokens": 32000
  },
  "budget": {
    "maxSteps": 12,
    "tokenBudget": 40000,
    "maxToolCalls": 32,
    "wallClockBudgetMs": 300000
  },
  "evaluation": {
    "verifierVersion": "smoke-verifier-v1",
    "evaluatorCommit": "dddddddddddddddddddddddddddddddddddddddd",
    "scorer": "all-tests-pass-v1"
  },
  "outcome": {
    "endedAt": "2026-07-30T01:00:08.000Z",
    "usage": {
      "inputTokens": 1200,
      "outputTokens": 300,
      "totalTokens": 1500,
      "complete": true
    },
    "steps": 4,
    "toolCallCount": 5,
    "latencyMs": 8000,
    "terminalReason": "verified",
    "patchHash": "4444444444444444444444444444444444444444444444444444444444444444",
    "testResult": {
      "status": "passed",
      "exitCode": 0,
      "summary": "2 tests passed",
      "durationMs": 250
    }
  },
  "artifacts": {
    "tracePath": "runs/w3-model-ab-a/trace.jsonl",
    "traceSha256": "5555555555555555555555555555555555555555555555555555555555555555",
    "patchPath": "runs/w3-model-ab-a/patch.diff",
    "patchSha256": "4444444444444444444444444444444444444444444444444444444444444444",
    "verifierResultPath": "runs/w3-model-ab-a/verifier-result.json",
    "verifierResultSha256": "6666666666666666666666666666666666666666666666666666666666666666"
  }
}
