{
  "schemaVersion": 1,
  "runId": "w3-scripted-2026-08-08T09-42-19-039Z-06-async-cache",
  "comparisonId": null,
  "attemptIndex": 0,
  "identity": {
    "taskId": "w3-async-cache",
    "baseSha": "d8ece3dc06efc5502c6bb1f5c4fa333026e459ea",
    "fixtureVersion": "unknown",
    "startedAt": "2026-08-08T09:42:25.758Z",
    "agentCommit": "ac0db2579a7e409038b8f565aff1eb7ec1a41981+dirty",
    "harnessCommit": "ac0db2579a7e409038b8f565aff1eb7ec1a41981+dirty"
  },
  "model": {
    "provider": "scripted-mock",
    "modelId": "scripted-mock",
    "modelRevision": "unknown",
    "reasoningEffort": "unsupported",
    "temperature": "unsupported",
    "topP": "unsupported",
    "seed": "unsupported"
  },
  "prompt": {
    "systemPromptHash": "7ba330c06ee5f382bc1d98b54864185e358dc769847980f2b89fccbae74e6954"
  },
  "tools": {
    "toolSchemaHash": "7906f0375a41942c08aec692fbdde6d7f345ff1df9aeef4fa6a30ad1e09969d0",
    "enabledTools": [
      "apply_patch",
      "diff",
      "exec",
      "read",
      "symbols",
      "tree"
    ],
    "toolPolicyHash": "3cb75bf41772fc7d4ece92356448214acf5d8fb69d634ef641107376680053f5"
  },
  "context": {
    "contextStrategy": "full-transcript-v1",
    "maxContextTokens": "unsupported"
  },
  "budget": {
    "maxSteps": 4,
    "tokenBudget": 100000,
    "maxToolCalls": 64,
    "wallClockBudgetMs": 300000
  },
  "evaluation": {
    "verifierVersion": "w3-command-verifier-v1+sha256:82f0db75e8db686bd1b4dda2524ae39d183316dd9f610c94636c58b5fbdc2235",
    "evaluatorCommit": "ac0db2579a7e409038b8f565aff1eb7ec1a41981+dirty",
    "scorer": "deterministic-command-v1"
  },
  "outcome": {
    "endedAt": "2026-08-08T09:42:25.841Z",
    "usage": {
      "inputTokens": 820,
      "outputTokens": 80,
      "totalTokens": 900,
      "complete": true
    },
    "steps": 4,
    "toolCallCount": 4,
    "latencyMs": 36,
    "terminalReason": "step_budget_exhausted",
    "patchHash": "e3b0c44298fc1c149afbf4c8996fb92427ae41e4649b934ca495991b7852b855",
    "testResult": {
      "status": "not_run",
      "exitCode": null,
      "summary": "Verifier was not run",
      "durationMs": 0
    }
  },
  "artifacts": {
    "tracePath": "trace.jsonl",
    "traceSha256": "458b6abc049703e2a5112e5c376567affb6cc3f84119636f00fb690c0e3d3f3e",
    "patchPath": "prediction.patch",
    "patchSha256": "e3b0c44298fc1c149afbf4c8996fb92427ae41e4649b934ca495991b7852b855",
    "verifierResultPath": "verifier-result.json",
    "verifierResultSha256": "364d954c2794f7ae0862f3e80d4d57d3abbb0db27f06a8078cc09c63148ae920"
  }
}
