{
  "schemaVersion": 1,
  "runId": "w3-scripted-2026-08-08T09-42-19-039Z-03-normalize-greeting",
  "comparisonId": null,
  "attemptIndex": 0,
  "identity": {
    "taskId": "w3-normalize-greeting",
    "baseSha": "044437bf8e3488adb3a5b61a6cd98f208c5dd1b8",
    "fixtureVersion": "unknown",
    "startedAt": "2026-08-08T09:42:21.721Z",
    "agentCommit": "ac0db2579a7e409038b8f565aff1eb7ec1a41981+dirty",
    "harnessCommit": "ac0db2579a7e409038b8f565aff1eb7ec1a41981+dirty"
  },
  "model": {
    "provider": "scripted-mock",
    "modelId": "scripted-mock",
    "modelRevision": "unknown",
    "reasoningEffort": "unsupported",
    "temperature": "unsupported",
    "topP": "unsupported",
    "seed": "unsupported"
  },
  "prompt": {
    "systemPromptHash": "7ba330c06ee5f382bc1d98b54864185e358dc769847980f2b89fccbae74e6954"
  },
  "tools": {
    "toolSchemaHash": "7906f0375a41942c08aec692fbdde6d7f345ff1df9aeef4fa6a30ad1e09969d0",
    "enabledTools": [
      "apply_patch",
      "diff",
      "exec",
      "read",
      "symbols",
      "tree"
    ],
    "toolPolicyHash": "3cb75bf41772fc7d4ece92356448214acf5d8fb69d634ef641107376680053f5"
  },
  "context": {
    "contextStrategy": "full-transcript-v1",
    "maxContextTokens": "unsupported"
  },
  "budget": {
    "maxSteps": 7,
    "tokenBudget": 100000,
    "maxToolCalls": 64,
    "wallClockBudgetMs": 300000
  },
  "evaluation": {
    "verifierVersion": "w3-command-verifier-v1+sha256:9f87a74663aea41bab86f6e025210872cac5c36e33766fe9ac36c4434ae1d68f",
    "evaluatorCommit": "ac0db2579a7e409038b8f565aff1eb7ec1a41981+dirty",
    "scorer": "deterministic-command-v1"
  },
  "outcome": {
    "endedAt": "2026-08-08T09:42:22.528Z",
    "usage": {
      "inputTokens": 875,
      "outputTokens": 132,
      "totalTokens": 1007,
      "complete": true
    },
    "steps": 4,
    "toolCallCount": 3,
    "latencyMs": 706,
    "terminalReason": "verified",
    "patchHash": "2c87231e072ccbfc4d58725a36f2a79ec8e0cf655f86e074d983b5ed084d0ca8",
    "testResult": {
      "status": "passed",
      "exitCode": 0,
      "summary": "greet normalizes names",
      "durationMs": 210
    }
  },
  "artifacts": {
    "tracePath": "trace.jsonl",
    "traceSha256": "78976b56816781d05278cab47d614b3d57ec478ffe800cf94e2c5a671d827ccd",
    "patchPath": "prediction.patch",
    "patchSha256": "2c87231e072ccbfc4d58725a36f2a79ec8e0cf655f86e074d983b5ed084d0ca8",
    "verifierResultPath": "verifier-result.json",
    "verifierResultSha256": "dd3facf5df8fcccd6db1d86bd195285bd80f25cf4bce63613a07f15945c7e0fe"
  }
}
