{
  "schemaVersion": 1,
  "runId": "w3-scripted-2026-08-08T09-42-19-039Z-05-point-summary",
  "comparisonId": null,
  "attemptIndex": 0,
  "identity": {
    "taskId": "w3-point-summary",
    "baseSha": "ba890a53776294a0a1dc898b53d58120208d4b57",
    "fixtureVersion": "unknown",
    "startedAt": "2026-08-08T09:42:25.020Z",
    "agentCommit": "ac0db2579a7e409038b8f565aff1eb7ec1a41981+dirty",
    "harnessCommit": "ac0db2579a7e409038b8f565aff1eb7ec1a41981+dirty"
  },
  "model": {
    "provider": "scripted-mock",
    "modelId": "scripted-mock",
    "modelRevision": "unknown",
    "reasoningEffort": "unsupported",
    "temperature": "unsupported",
    "topP": "unsupported",
    "seed": "unsupported"
  },
  "prompt": {
    "systemPromptHash": "7ba330c06ee5f382bc1d98b54864185e358dc769847980f2b89fccbae74e6954"
  },
  "tools": {
    "toolSchemaHash": "7906f0375a41942c08aec692fbdde6d7f345ff1df9aeef4fa6a30ad1e09969d0",
    "enabledTools": [
      "apply_patch",
      "diff",
      "exec",
      "read",
      "symbols",
      "tree"
    ],
    "toolPolicyHash": "3cb75bf41772fc7d4ece92356448214acf5d8fb69d634ef641107376680053f5"
  },
  "context": {
    "contextStrategy": "full-transcript-v1",
    "maxContextTokens": "unsupported"
  },
  "budget": {
    "maxSteps": 7,
    "tokenBudget": 100000,
    "maxToolCalls": 64,
    "wallClockBudgetMs": 300000
  },
  "evaluation": {
    "verifierVersion": "w3-command-verifier-v1+sha256:53f8b9c4ba5a22fd4a6c6fe9b7ca85160e3531adcfaaaf1adc1d7f33a7070fb6",
    "evaluatorCommit": "ac0db2579a7e409038b8f565aff1eb7ec1a41981+dirty",
    "scorer": "deterministic-command-v1"
  },
  "outcome": {
    "endedAt": "2026-08-08T09:42:25.222Z",
    "usage": {
      "inputTokens": 340,
      "outputTokens": 46,
      "totalTokens": 386,
      "complete": false
    },
    "steps": 3,
    "toolCallCount": 1,
    "latencyMs": 154,
    "terminalReason": "provider_failed",
    "patchHash": "e3b0c44298fc1c149afbf4c8996fb92427ae41e4649b934ca495991b7852b855",
    "testResult": {
      "status": "failed",
      "exitCode": 1,
      "summary": "greetPoint mismatch: expected \"Ada: (2, -4)\", received \" Ada : 2,-4\"",
      "durationMs": 105
    }
  },
  "artifacts": {
    "tracePath": "trace.jsonl",
    "traceSha256": "718153ac1f716188301bfb227419044d6a0305623eb8b3e799495f93d5ea5f31",
    "patchPath": "prediction.patch",
    "patchSha256": "e3b0c44298fc1c149afbf4c8996fb92427ae41e4649b934ca495991b7852b855",
    "verifierResultPath": "verifier-result.json",
    "verifierResultSha256": "0afb65d86854af8c856bd72c2ce88b901ce83d0d440db701310fa8c3c05abb9a"
  }
}
